{
  "$schema": "../../docs/zh_cn/schemas/part/subpart/connector/connector_static_attr.schema.json",
  "type": "Advanced",
  "direction": "zn",
  "integrity": 10.0,
  "joint_attrs": {
    "zr": {
      "lower_limit": -30.0,
      "upper_limit": 30.0,
      "equilibrium": 0.0,
      "stiffness": 69.757389,
      "damping": 1.736319
    }
  }
}
