{
  "$schema": "../../docs/zh_cn/schemas/part/subpart/connector/connector_static_attr.schema.json",
  "type": "Advanced",
  "direction": "yp",
  "integrity": 50.0,
  "impact_absorption": 0.25,
  "impact_reduction": 5.0,
  "impact_multiplier": 1.0,
  "joint_attrs": {
    "xr": {
      "lower_limit": -10.0,
      "upper_limit": 10.0,
      "damping": 8.712058
    },
    "yr": {
      "lower_limit": -85.0,
      "upper_limit": 85.0,
      "damping": 8.712058
    },
    "zr": {
      "lower_limit": -5.0,
      "upper_limit": 5.0,
      "stiffness": 174.545782,
      "damping": 17.454578
    }
  }
}
