{
  "$schema": "../../docs/zh_cn/schemas/part/subpart/connector/connector_static_attr.schema.json",
  "type": "Advanced",
  "direction": "xn",
  "integrity": 80.0,
  "impact_reduction": 3.0,
  "impact_multiplier": 0.8,
  "required_tags": ["machine_max:direction/left"],
  "acceptable_tags": [],
  "forbidden_tags": ["machine_max:hull", "machine_max:chassis"],
  "joint_attrs": {
    "y": {
      "lower_limit": -1.0,
      "upper_limit": 1.0,
      "equilibrium": -0.1,
      "stiffness": 5000,
      "damping": 200
    },
    "xr": {
      "lower_limit": 1.0,
      "upper_limit": -1.0
    },
    "yr": {
      "lower_limit": -45.0,
      "upper_limit": 45.0,
      "stiffness": 17.363193,
      "damping": 0.35031
    },
    "zr": {
      "lower_limit": 1.0,
      "upper_limit": 15.0,
      "equilibrium": 1.0,
      "stiffness": 261.666364,
      "damping": 5.23942
    }
  }
}
