{
  "$schema": "../../docs/zh_cn/schemas/part/subpart/connector/connector_static_attr.schema.json",
  "type": "Advanced",
  "direction": "xn",
  "integrity": 1500.0,
  "impact_reduction": 3.0,
  "impact_multiplier": 0.8,
  "required_tags": ["machine_max:left"],
  "acceptable_tags": [],
  "forbidden_tags": [],
  "joint_attrs": {
    "y": {
      "lower_limit": -0.5,
      "upper_limit": 0.6,
      "equilibrium": -0.15,
      "stiffness": 120000,
      "damping": 3500
    },
    "xr": {
      "lower_limit": 1,
      "upper_limit": -1
    },
    "zr": {
      "lower_limit": 1.0,
      "upper_limit": 8.0,
      "equilibrium": 1.0,
      "stiffness": 120000,
      "damping": 3500
    }
  }
}