{
  "$schema": "../../docs/zh_cn/schemas/part/subpart/connector/connector_static_attr.schema.json",
  "type": "Advanced",
  "direction": "xn",
  "integrity": 60.0,
  "required_tags": ["machine_max:left", "machine_max:back"],
  "forbidden_tags": ["machine_max:hull", "machine_max:chassis"],
  "joint_attrs": {
    "y": {
      "lower_limit": -1.0,
      "upper_limit": 0.5,
      "equilibrium": -0.1,
      "stiffness": 65000,
      "damping": 1500
    },
    "xr": {
      "lower_limit": 1.0,
      "upper_limit": -1.0
    },
    "zr": {
      "lower_limit": 1.0,
      "upper_limit": 3.0,
      "equilibrium": 1.0,
      "stiffness": 25000,
      "damping": 350
    }
  }
}