{
  "$schema": "../../docs/zh_cn/schemas/part/subpart/connector/connector_static_attr.schema.json",
  "type": "Advanced",
  "required_tags": [
    "machine_max:hood"
  ],
  "integrity": 15.0,
  "impact_absorption": 0.30,
  "impact_reduction": 2.0,
  "impact_multiplier": 1.0,
  "joint_attrs": {
    "xr": {
      "lower_limit": 0.0,
      "upper_limit": 80.0,
      "equilibrium": 45.0,
      "stiffness": 17.363193,
      "damping": 1.736319
    }
  }
}
